{
  "$schema": "../../schemas/release-record.schema.json",
  "schemaVersion": 1,
  "productId": "zui-youtube-webos",
  "version": "0.8.4",
  "channel": "stable",
  "sourceRepository": "https://github.com/ZUI-WebOS/ZUI-YouTube-WebOS",
  "releaseRef": "integration-0.8.4",
  "artifacts": [
    {
      "artifactId": "zui-youtube-webos-0.8.4-staging",
      "filename": "com.zui.webos.youtube.staging_0.8.4_all.ipk",
      "appId": "com.zui.webos.youtube.staging",
      "version": "0.8.4",
      "deploymentClass": "staging",
      "size": 94208,
      "hash": {
        "algorithm": "sha256",
        "digest": "816ECFBEBC234443B4E492A9EE7472DDCBB1783CF09B5100BA9B321A882A66F4"
      },
      "source": {
        "type": "LOCAL_VERIFIED",
        "repository": "https://github.com/ZUI-WebOS/ZUI-YouTube-WebOS",
        "releaseRef": "integration-0.8.4",
        "assetName": "com.zui.webos.youtube.staging_0.8.4_all.ipk",
        "evidencePath": ".migration-rehearsal/youtube-integration-0.8.4/artifacts/integration-0.8.4/staging/com.zui.webos.youtube.staging_0.8.4_all.ipk"
      }
    },
    {
      "artifactId": "zui-youtube-webos-0.8.4-production",
      "filename": "youtube.leanback.v4_0.8.4_all.ipk",
      "appId": "youtube.leanback.v4",
      "version": "0.8.4",
      "deploymentClass": "production",
      "size": 94188,
      "hash": {
        "algorithm": "sha256",
        "digest": "9702EC57B69CB145EF7919DB2F79BA7FD3714F3D000E6A04C5F638F9F7817F3E"
      },
      "source": {
        "type": "LOCAL_VERIFIED",
        "repository": "https://github.com/ZUI-WebOS/ZUI-YouTube-WebOS",
        "releaseRef": "integration-0.8.4",
        "assetName": "youtube.leanback.v4_0.8.4_all.ipk",
        "evidencePath": ".migration-rehearsal/youtube-integration-0.8.4/artifacts/integration-0.8.4/production/youtube.leanback.v4_0.8.4_all.ipk"
      }
    }
  ]
}
